"6355610","American Realty Brokers (amer01)","(602) 955-6606","Tiffany M Wright","","Residential","Residential","","","","","Single Family - Detached","2022-02-14","","","","A","2022-03-23","","","","624934.00","599990.00","","353.35","R37","602","","E","BROADWAY","","","LN","","Tempe","AZ","Maricopa","USA","85282","33.407792","-111.929021","1698.00","3.00","1958","%","Y","N","N","3","2.00","1","1","T","None","2207.00","2021","LOT 129 UNIVERSITY HEIGHTS MCR 005719","Gorgeous and completely remodeled Tempe home. Detached workshop was also remodeled. Indoor washer/dryer and another washer/dryer accessible from outside. Kitchen has brand new cabinets, stone countertops from out of the country, new Pro Series Frigidaire appliances. Flooring is all tile. Guest bath has a new shower surround, tile, and new cabinets. Master shower has double sinks with 6 shower heads. Artificial grass in the front. Indoor and outside washer/dryer convey with the home. Mini split A/C for the remodeled detached workshop. House roof replaced in 2021 and new hot water heater. New LED lights throughout the house.  All the fixtures are Moen and Pfister.","Workshop was remodeled to be an ADU but it is not permitted as an ADU. Sliding glass door will be installed for the workshop. Title work has been started with Elevated Title, Jim Restivo,  JRestivo@ElevatedTitle.com,  (714)875-6640","133-12-129","","West on Broadway to Ventura, right (north) on Ventura, immediate right (east) on Broadway Ln, house will be on the left.","602 EAST BROADWAY LLC","","","Unknown","2022-03-29 18:06:15.352354","","","T","Tempe","No","N","Fee Simple","","ER","Broadmor Elementary","Connolly","Tempe High School","003","213","","","1433","","","2.00","","","7336.00","133.00","12.00","129.00","","Rural and Broadway","UNIVERSITY HEIGHTS","Detached","","0.1680","2022-02-16","http://cdn.photos.sparkplatform.com/az/20220216105639678092000000.jpg","42","","Association & Fees|HOA Y/N|N;Items Updated|Floor Partial/Full|Full;Items Updated|Bath(s) Partial/Full|Full;Items Updated|Kitchen Partial/Full|Full;Items Updated|Roof Partial/Full|Partial;Items Updated|Wiring Partial/Full|Partial;Items Updated|Plmbg Partial/Full|Partial;Items Updated|Ht/Cool Partial/Full|Partial;Association & Fees|PAD Fee Y/N|N;Association & Fees|Land Lease Fee Y/N|N;Basement|Basement Y/N|N;Separate Den/Office|Sep Den/Office Y/N|N;Showing Instructions|To Schedule Showing|Contact Via ShowingTime, Text, Phone or Email;Showing Instructions|Primary Showing Contact|Listing Agent;Showing Instructions|Permission Required to Show|Yes;Showing Instructions|ARMLS Lockbox|Yes;Showing Instructions|Non-ARMLS Lockbox|No;Association & Fees|Ttl Mthly Fee Equiv|0;Community Features|Biking/Walking Path|Yes;Contact Info|List Agt Primary Phn|480-606-8590;Contact Info|Office Fax Number|602-468-3706;Contact Info|List Agent Cell Phn|480-606-8590;Existing 1st Ln Trms|Non Assumable|Yes;Exterior Features|Separate Guest House|Yes;Flooring|Tile|Yes;Items Updated|Floor Yr Updated|2021;Items Updated|Wiring Yr Updated|2021;Items Updated|Plmbg Yr Updated|2021;Items Updated|Ht/Cool Yr Updated|2021;Items Updated|Roof Yr Updated|2021;Items Updated|Kitchen Yr Updated|2021;Items Updated|Bath(s) Yr Updated|2021;Legal Info|Township|1N;Legal Info|Lot Number|129;Legal Info|Section|22;Legal Info|Range|4E;Other Rooms|Family Room|Yes;Parking Features|Unassigned Parking|Yes;Parking Spaces|Garage Spaces|1;Parking Spaces|Total Covered Spaces|1;Parking Spaces|Slab Parking Spaces|2;Parking Spaces|Carport Spaces|0;Plumbing|Electric Hot Wtr Htr|Yes;Road Responsibility|City Maintained Road|Yes;Showing Instructions|Tenants' Rights|Yes;Technology|Pre-Wire Sat Dish|Yes;Technology|HighSpd Intrnt Aval|Yes;Occupant - DND2|Tenant|Yes;Possession|Close of Escrow|Yes;Spa|None|Yes;Heating|Electric|Yes;Heating|Mini Split|Yes;Water|City Water|Yes;Disclosures|Seller Discl Avail|Yes;Cooling|Refrigeration|Yes;Cooling|Mini Split|Yes;Dining Area|Breakfast Bar|Yes;Existing 1st Loan|Treat as Free&Clear|Yes;Sewer|Sewer - Public|Yes;Const - Finish|Painted|Yes;Const - Finish|Brick Trim/Veneer|Yes;Utilities|APS|Yes;Fencing|Block|Yes;Master Bathroom|Full Bth Master Bdrm|Yes;Master Bathroom|Double Sinks|Yes;Pool Features|No Pool|Yes;Laundry|Washer Included|Yes;Laundry|See Remarks|Yes;Laundry|Inside|Yes;Laundry|Dryer Included|Yes;Roofing|Comp Shingle|Yes;Construction|Block|Yes;Fireplace|No Fireplace|Yes;Assoc Rules/Info|None|Yes;New Financing|Cash|Yes;New Financing|Conventional|Yes;New Financing|FHA|Yes;New Financing|VA|Yes;Special Listing Cond|N/A|Yes;Association Fee Incl|No Fees|Yes;Landscaping|Yrd Wtring Sys Front|Yes;Landscaping|Dirt Back|Yes;Landscaping|Synthetic Grass Frnt|Yes;Kitchen Features|Dishwasher|Yes;Kitchen Features|Built-in Microwave|Yes;Kitchen Features|Cook Top Elec|Yes;Kitchen Features|Range/Oven Elec|Yes;Kitchen Features|Pantry|Yes;Kitchen Features|Refrigerator|Yes;Kitchen Features|Disposal|Yes;"
"6371531","Realty Executives (reax20)","(480) 961-5800","Jason Vaught","Adam C Vaught","Residential","Residential","","","","","Single Family - Detached","2022-03-21","","","","A","2022-03-22","","","","1950000.00","1950000.00","","609.38","R37","1224","","S","MAPLE","","","AVE","","Tempe","AZ","Maricopa","USA","85281","33.415109","-111.941531","3200.00","6.00","1950","%","Y","N","N","6","4.00","1","1","T","None","5783.00","2021","LOT 13 BLOCK 6 PARK TRACT MCR 001327","Three separate detached units on the lot, LOCATION, LOCATION, LOCATION!  Unique opportunity in desirable area of Tempe, walking distance ASU campus and downtown Tempe attractions.  The main house is about 1800 square feet with 3 bedrooms 2 baths, second  home (1224 1/2 Maple) is a 2 bedroom 1 bath, third (1224 3/4 Maple) is a 1 bedroom 1 bath with great room which could be turned into second bedroom.  All units have been updated with flooring, baths and kitchen remodels.  Alley access for the back units plus a drive through tandem garage and covered parking space.","Must make appointment to show with owner, Owner is a licensed Realtor in California.  A minimum of 24 hour notice for tenant is requested.  Buyer to verify all information","132-45-085","","West on 13th St / Right on Maple to home","MILAD SADEGI","858-405-1282","ASU close","UNK","2022-03-27 12:12:02.385244","","","O","Tempe","No","N","Fee Simple","1300","ER","Holdeman","Gililland","Tempe High School","003","213","","W","8666","","","2.50","","","9783.00","132.00","45.00","85.00","","Mill Ave & 13th St","PARK TRACT","Detached","","0.2250","2022-03-22","http://cdn.photos.sparkplatform.com/az/20220321230913050523000000.jpg","8","","Association & Fees|HOA Y/N|N;Association & Fees|PAD Fee Y/N|N;Association & Fees|Land Lease Fee Y/N|N;Basement|Basement Y/N|N;Separate Den/Office|Sep Den/Office Y/N|N;Showing Instructions|To Schedule Showing|Contact Via Phone;Showing Instructions|Permission Required to Show|Yes;Showing Instructions|ARMLS Lockbox|No;Showing Instructions|Non-ARMLS Lockbox|No;Showing Instructions|Primary Showing Contact|Owner;Architecture|Ranch|Yes;Association & Fees|Ttl Mthly Fee Equiv|0;Building Style|2-3-4 Plex|Yes;Contact Info|List Agt Primary Phn|480-706-1936;Contact Info|CoList Primary Phn|480-706-1936;Contact Info|Office Fax Number|480-706-1925;Contact Info|List Agent Cell Phn|480-570-8190;Existing 1st Ln Trms|Non Assumable|Yes;Exterior Features|Separate Guest House|Yes;Exterior Features|Pvt Yrd(s)/Crtyrd(s)|Yes;Features|No Interior Steps|Yes;Flooring|Carpet|Yes;Flooring|Tile|Yes;Legal Info|Township|1N;Legal Info|Lot Number|13;Legal Info|Block|6;Legal Info|Section|22;Legal Info|Range|4E;Other Rooms|Great Room|Yes;Other Rooms|Guest Qtrs-Sep Entrn|Yes;Parking Features|Rear Vehicle Entry|Yes;Parking Features|Electric Door Opener|Yes;Parking Spaces|Garage Spaces|2;Parking Spaces|Total Covered Spaces|3;Parking Spaces|Slab Parking Spaces|4;Parking Spaces|Carport Spaces|1;Plumbing|Electric Hot Wtr Htr|Yes;Property Description|North/South Exposure|Yes;Property Description|Alley|Yes;Showing Instructions|Tenants' Rights|Yes;Technology|Cable TV Avail|Yes;Technology|HighSpd Intrnt Aval|Yes;Occupant - DND2|Tenant|Yes;Possession|Close of Escrow|Yes;Spa|None|Yes;Heating|Natural Gas|Yes;Water|City Water|Yes;Disclosures|Seller Discl Avail|Yes;Disclosures|Agency Discl Req|Yes;Cooling|Ceiling Fan(s)|Yes;Cooling|Programmable Thmstat|Yes;Cooling|Refrigeration|Yes;Dining Area|Formal|Yes;Existing 1st Loan|Treat as Free&Clear|Yes;Sewer|Sewer - Public|Yes;Const - Finish|Painted|Yes;Const - Finish|Stucco|Yes;Utilities|SRP|Yes;Utilities|SW Gas|Yes;Fencing|Block|Yes;Master Bathroom|Full Bth Master Bdrm|Yes;Master Bathroom|Double Sinks|Yes;Pool Features|No Pool|Yes;Laundry|Wshr/Dry HookUp Only|Yes;Laundry|Inside|Yes;Roofing|Comp Shingle|Yes;Construction|Block|Yes;Fireplace|No Fireplace|Yes;Assoc Rules/Info|Not Managed|Yes;Assoc Rules/Info|Other (See Remarks)|Yes;New Financing|Cash|Yes;New Financing|Conventional|Yes;Special Listing Cond|Owner/Agent|Yes;Association Fee Incl|No Fees|Yes;Landscaping|Grass Front|Yes;Landscaping|Irrigation Front|Yes;Landscaping|Grass Back|Yes;Kitchen Features|Dishwasher|Yes;Kitchen Features|Granite Countertops|Yes;Kitchen Features|Range/Oven Elec|Yes;Kitchen Features|Refrigerator|Yes;Kitchen Features|Disposal|Yes;"
"6330268","Venture REI, LLC (vrei01)","(480) 269-8499","Daniel P Noma","Frank Vazquez","Residential","Residential","","","","","Single Family - Detached","2021-12-09","","","","A","2022-03-16","","","N","530000.00","530000.00","","271.52","R36","1318","","S","SHAFER","","","DR","","Tempe","AZ","Maricopa","USA","85281","33.413919","-111.957274","1952.00","4.00","1977","%","Y","N","N","4","2.00","1","1","T","None","2266.00","2021","LOT 41 STARLITE MANOR MCR 017239","This single-level home in Tempe is waiting just for you! Located near schools, restaurants, & much more. Discover a welcoming interior w/everything you have been looking for; carpet in all the right places, neutral palette, & so much natural light great for interior plants. Gather around the beautiful stone fireplace this holidays. Well-kept kitchen is equipped w/ample cabinetry, plenty of counter space, built-in appliances, & breakfast bar. The primary bedroom offers makeup vanity, closets & a private bathroom for added comfort. Large grassy backyard w/covered patio & citrus trees is ready to enjoy. Come make this unique home your own!","For real time number of offers go to http://current-listings.com. For other questions, please ONLY call 480-409-9900 or email Contracts@venturehomegroup.com. Please refer to the Offer Process and FAQ in the docs tab. ***All offers must be submitted through this link to be considered: https://my.brokermint.com/offers/a93adfea89/new","124-59-154","","Head north on S Priest Dr, Right onto W 13th St, Right onto S Shafer Dr. Property will be on the right.","Client of Venture REI","","","STURDI-BUILT","2022-03-16 11:26:35.853481","","","T","Tempe","No","N","Fee Simple","1300","ER","Holdeman","Gililland","Tempe High School","210","210","","W","6321","","","2.25","","","8285.00","124.00","59.00","154.00","","Broadway Rd & Priest Dr","STARLITE MANOR","Detached","","0.1900","","http://cdn.photos.sparkplatform.com/az/20211209175024900925000000.jpg","111","","Association & Fees|Rec Center Fee Y/N|N;Association & Fees|HOA Y/N|N;Association & Fees|PAD Fee Y/N|N;Association & Fees|Land Lease Fee Y/N|N;Association & Fees|Cap Impv/Impt Fee$/%|$;Association & Fees|Cap Impv/ImptFee2$/%|$;Association & Fees|Rec Center Fee 2 Y/N|N;Basement|Basement Y/N|N;Separate Den/Office|Sep Den/Office Y/N|N;Showing Instructions|To Schedule Showing|Use ShowingTime;Showing Instructions|Primary Showing Contact|Co-Listing Agent;Showing Instructions|Permission Required to Show|Yes;Showing Instructions|ARMLS Lockbox|Yes;Showing Instructions|Non-ARMLS Lockbox|No;Add'l Property Use|None|Yes;Architecture|Ranch|Yes;Association & Fees|Cap Impv/Impt Fee 2|0;Association & Fees|Ttl Mthly Fee Equiv|0;Association & Fees|Cap Imprv/Impact Fee|0;Association & Fees|PAD Fee|0;Contact Info|List Agent Home Phn|480-409-9900;Contact Info|CoList Primary Phn|480-409-9900;Contact Info|List Agent Hme Phn 2|480-409-9900;Contact Info|List Agent Cell Phn2|480-409-9900;Contact Info|Office Fax Number|480-409-9900;Contact Info|List Agent Cell Phn|480-409-9900;Contact Info|List Agent Ofc Phn2|480-409-9900;Contact Info|List Agt Primary Phn|480-409-9900;Exterior Features|Patio|Yes;Exterior Features|Covered Patio(s)|Yes;Flooring|Carpet|Yes;Flooring|Tile|Yes;Legal Info|Township|1N;Legal Info|Lot Number|41;Legal Info|Section|21;Legal Info|Range|4E;Other Rooms|Family Room|Yes;Parking Features|RV Gate|Yes;Parking Features|Dir Entry frm Garage|Yes;Parking Features|Electric Door Opener|Yes;Parking Spaces|Garage Spaces|2;Parking Spaces|Total Covered Spaces|2;Parking Spaces|Slab Parking Spaces|2;Parking Spaces|Carport Spaces|0;Pmt & Rate Info|Total Encumbrance|0;Pmt & Rate Info|Total Asum Mnth Pmts|0;Pmt & Rate Info|Down Payment|0;Property Description|Cul-De-Sac Lot|Yes;Property Description|Alley|Yes;Services|City Services|Yes;Technology|Cable TV Avail|Yes;Technology|HighSpd Intrnt Aval|Yes;Occupant - DND2|Vacant|Yes;Possession|Close of Escrow|Yes;Spa|None|Yes;Heating|Electric|Yes;Water|City Water|Yes;Disclosures|Other (See Remarks)|Yes;Cooling|Ceiling Fan(s)|Yes;Cooling|Both Refrig & Evap|Yes;Dining Area|Eat-in Kitchen|Yes;Dining Area|Breakfast Bar|Yes;Existing 1st Loan|Treat as Free&Clear|Yes;Sewer|Sewer - Public|Yes;Const - Finish|Brick Trim/Veneer|Yes;Utilities|SRP|Yes;Fencing|Block|Yes;Master Bathroom|3/4 Bath Master Bdrm|Yes;Pool Features|No Pool|Yes;Laundry|Wshr/Dry HookUp Only|Yes;Laundry|Inside|Yes;Roofing|Comp Shingle|Yes;Construction|Block|Yes;Fireplace|1 Fireplace|Yes;Fireplace|Two Way Fireplace|Yes;Fireplace|Fireplace Living Rm|Yes;Assoc Rules/Info|None|Yes;New Financing|Cash|Yes;New Financing|Conventional|Yes;New Financing|VA|Yes;Special Listing Cond|N/A|Yes;Association Fee Incl|No Fees|Yes;Landscaping|Dirt Back|Yes;Landscaping|Natural Desert Front|Yes;Landscaping|Grass Back|Yes;Landscaping|Grass Front|Yes;Kitchen Features|Dishwasher|Yes;Kitchen Features|Laminate Counters|Yes;Kitchen Features|Range/Oven Elec|Yes;Kitchen Features|Pantry|Yes;Kitchen Features|Disposal|Yes;"
"6268713","New Start Realty and Relocation (nsrr01)","(623) 583-6346","Kevin Beasley","","Residential","Residential","","","","","Single Family - Detached","2021-07-23","","","2022-01-29","A","2022-02-01","","","","467000.00","472000.00","","245.83","S37","501","","E","WESTCHESTER","","E","DR","","Tempe","AZ","Maricopa","USA","85283","33.367144","-111.931674","1920.00","7.00","1972","%","Y","N","N","6","2.00","1","1","T","Private","1956.00","2020","LOT 6 COLLEGE PARK UNIT 4 MCR 014032","Walking distance to Marcos De Niza (Awesome) Near Kiwanis's Park Both within walking distance- Property will need work. Owner has converted garage,family and living area into bedrooms, but can be easily converted back however this is the perfect opportunity to remodel a home to your specs in a highly coveted area in a highly sought after subdivision NO HOA, great neighbors, great schools few miles to ASU- Owner may consider a trade for F&C home in AZ low elevations","Selling As Is. Sellers needs to net 445k 472K will do it See net sheet in docs tab (He pays 55k in liens) SHOWINGS are FRI & SAT-10-12 ONLY Text LA Kevin Beasley 602-920-2201 for offer status. Use Showtime to schedule showing- once approved, TEXT Andrew (owner) FOR  SHOWING APPOINTMENT  at 480 -809-8700  PLEASE TEXT ONLY-   Inside video (branded)   https://youtu.be/OoPxPj7909g","301-81-009","","Property Does GPS -Google Maps","ANDREW THOMAS MAREZ","","","Unknown","2022-03-04 22:32:32.221149","","","O","Tempe","No","N","Fee Simple","","ER","Aguilar","Fees","Marcos De Niza","003","213","","","2891","","","2.50","","","6865.00","301.00","81.00","9.00","","Rual - Guadalupe","COLLEGE PARK UNIT 4","Detached","TBD","0.1580","","http://cdn.photos.sparkplatform.com/az/20210723101606212488000000.jpg","83","","Association & Fees|HOA Y/N|N;Association & Fees|PAD Fee Y/N|N;Association & Fees|Land Lease Fee Y/N|N;Basement|Basement Y/N|N;Separate Den/Office|Sep Den/Office Y/N|Y;Showing Instructions|To Schedule Showing|Contact Via Text;Showing Instructions|Primary Showing Contact|Listing Agent;Showing Instructions|Permission Required to Show|Yes;Showing Instructions|ARMLS Lockbox|No;Showing Instructions|Non-ARMLS Lockbox|No;Architecture|Ranch|Yes;Association & Fees|Ttl Mthly Fee Equiv|0;Contact Info|List Agt Primary Phn|602-920-2201;Contact Info|Office Fax Number|623-399-6929;Contact Info|List Agent Cell Phn|602-920-2201;Features|Fix-Up Needs Repair|Yes;Flooring|Carpet|Yes;Flooring|Tile|Yes;Flooring|Linoleum|Yes;Legal Info|Township|1S;Legal Info|Lot Number|6;Legal Info|Section|3;Legal Info|Range|4E;Other Rooms|Family Room|Yes;Parking Features|Tandem Garage|Yes;Parking Spaces|Garage Spaces|2;Parking Spaces|Total Covered Spaces|2;Parking Spaces|Slab Parking Spaces|2;Parking Spaces|Carport Spaces|0;Unit Style|All on One Level|Yes;Occupant - DND2|Owner|Yes;Possession|By Agreement|Yes;Possession|Close of Escrow|Yes;Spa|None|Yes;Heating|Electric|Yes;Water|City Water|Yes;Disclosures|Agency Discl Req|Yes;Cooling|Both Refrig & Evap|Yes;Dining Area|Eat-in Kitchen|Yes;Existing 1st Loan|Treat as Free&Clear|Yes;Sewer|Sewer - Public|Yes;Const - Finish|Painted|Yes;Const - Finish|Stucco|Yes;Utilities|SRP|Yes;Utilities|City Electric|Yes;Fencing|Block|Yes;Master Bathroom|Full Bth Master Bdrm|Yes;Pool Features|Private|Yes;Laundry|None|Yes;Roofing|Comp Shingle|Yes;Construction|Frame - Wood|Yes;Fireplace|1 Fireplace|Yes;Assoc Rules/Info|None|Yes;New Financing|Cash|Yes;New Financing|Trade|Yes;New Financing|FHA|Yes;Special Listing Cond|N/A|Yes;Association Fee Incl|No Fees|Yes;Landscaping|Desert Front|Yes;Landscaping|Desert Back|Yes;Kitchen Features|Disposal|Yes;Kitchen Features|Range/Oven Elec|Yes;Kitchen Features|Refrigerator|Yes;"
"6375212","Denali Real Estate, LLC (drel001)","(480) 626-4062","Michael Van Vleck","","Residential","Residential","","","","","Single Family - Detached","2022-03-27","","","","A","2022-03-29","","","","639900.00","639900.00","","303.70","Q37","1441","","N","El Camino","","","DR","","Tempe","AZ","Maricopa","USA","85281","33.444915","-111.932053","2107.00","3.00","1980","%","Y","N","Y","3","2.50","2","2","T","Private","3298.00","2021","MARLBOROUGH PARK ESTATES MCR 219-4","Centrally located 3 bedroom 2.5 bathroom Tempe home.   This home features a spacious living room with fireplace, separate family room with vaulted ceilings and a formal dining area.  Large open kitchen includes extra cabinet and counter top space, dining area, breakfast bar, separate pantry, electric ceramic top stove, built-in microwave, refrigerator and dishwasher.   All bedrooms are on the second floor with the primary suite including a walk-in closet and double sinks.   Backyard includes large pool, huge desert landscaped yard and covered back patio.","Please use showing time for all showing appointments.      All offers submitted will be reviewed by the seller the afternoon of April 1st.  Submit your best offer before April 1 at 5:00.  No need to call to see if it is available.  It is available.","132-02-007","","West on McKellips, South on College, East on Valeria, South on El Camino Drive.   Home on left.","Client of Denali Real Estate","","","NA","2022-03-29 03:28:13.768257","","","T","Tempe","No","N","Fee Simple","1700","ER","Laird","McKemy","McClintock","003","210","","N","1424","","","2.50","","","9261.00","132.00","2.00","7.00","","McKellips & Scottsdale Road","MARLBOROUGH PARK","Detached","","0.2130","","http://cdn.photos.sparkplatform.com/az/20220329082358504068000000.jpg","3","","Association & Fees|HOA Y/N|N;Association & Fees|PAD Fee Y/N|N;Association & Fees|Land Lease Fee Y/N|N;Basement|Basement Y/N|N;Separate Den/Office|Sep Den/Office Y/N|N;Showing Instructions|To Schedule Showing|Use ShowingTime;Showing Instructions|Permission Required to Show|Yes;Showing Instructions|ARMLS Lockbox|No;Showing Instructions|Non-ARMLS Lockbox|Yes;Additional Bedroom|Mstr Bdr Walkin Clst|Yes;Additional Bedroom|Othr Bdr Walkin Clst|Yes;Architecture|Ranch|Yes;Association & Fees|Ttl Mthly Fee Equiv|0;Building Style|Clustered|Yes;Contact Info|List Agt Primary Phn|480-626-4062;Contact Info|Office Fax Number|480-626-5214;Contact Info|List Agent Cell Phn|480-292-2151;Energy/Green Feature|Multi-Zones|Yes;Exterior Features|Patio|Yes;Exterior Features|Covered Patio(s)|Yes;Features|Vaulted Ceiling(s)|Yes;Legal Info|Township|1N;Legal Info|Lot Number|5;Legal Info|Block|1005;Legal Info|Section|10;Legal Info|Range|4E;Master Bedroom|Upstairs|Yes;Other Rooms|Family Room|Yes;Other Rooms|Great Room|Yes;Parking Features|Electric Door Opener|Yes;Parking Spaces|Garage Spaces|2;Parking Spaces|Total Covered Spaces|2;Parking Spaces|Slab Parking Spaces|2;Parking Spaces|Carport Spaces|0;Services|City Services|Yes;Technology|Pre-Wire Sat Dish|Yes;Technology|HighSpd Intrnt Aval|Yes;Technology|Cable TV Avail|Yes;Unit Style|Two Levels|Yes;Unit Style|Street Facing|Yes;Unit Style|No Common Walls|Yes;Occupant - DND2|Vacant|Yes;Possession|Close of Escrow|Yes;Spa|None|Yes;Heating|Electric|Yes;Water|City Water|Yes;Disclosures|None|Yes;Cooling|Ceiling Fan(s)|Yes;Cooling|Refrigeration|Yes;Dining Area|Eat-in Kitchen|Yes;Dining Area|Breakfast Bar|Yes;Dining Area|Dining in FR|Yes;Existing 1st Loan|Treat as Free&Clear|Yes;Sewer|Sewer - Public|Yes;Const - Finish|Painted|Yes;Const - Finish|Stucco|Yes;Utilities|SRP|Yes;Fencing|Block|Yes;Master Bathroom|Full Bth Master Bdrm|Yes;Master Bathroom|Double Sinks|Yes;Master Bathroom|Separate Shwr & Tub|Yes;Pool Features|Private|Yes;Laundry|Inside|Yes;Roofing|Comp Shingle|Yes;Construction|Frame - Wood|Yes;Fireplace|1 Fireplace|Yes;Fireplace|Fireplace Living Rm|Yes;Assoc Rules/Info|Pets OK (See Rmrks)|Yes;Assoc Rules/Info|VA Approved Prjct|Yes;Assoc Rules/Info|FHA Approved Prjct|Yes;Assoc Rules/Info|Rental OK (See Rmks)|Yes;New Financing|Cash|Yes;New Financing|Conventional|Yes;New Financing|FHA|Yes;New Financing|VA|Yes;Special Listing Cond|N/A|Yes;Association Fee Incl|No Fees|Yes;Landscaping|Desert Front|Yes;Landscaping|Auto Timer H2O Back|Yes;Landscaping|Auto Timer H2O Front|Yes;Landscaping|Yrd Wtring Sys Back|Yes;Landscaping|Yrd Wtring Sys Front|Yes;Landscaping|Desert Back|Yes;Kitchen Features|Dishwasher|Yes;Kitchen Features|Pantry|Yes;Kitchen Features|Refrigerator|Yes;Kitchen Features|Disposal|Yes;"
