"6365056","Realty Executives (reax15)","(480) 839-2600","Debbie Knight","","Residential","Residential","","","","","Single Family - Detached","2022-03-07","","","","A","2022-03-25","","","","769900.00","769900.00","","253.59","R37","2924","","S","FAIRWAY","","","DR","","Tempe","AZ","Maricopa","USA","85282","33.397379","-111.893278","3036.00","5.00","1972","%","Y","N","Y","5","2.50","7","2","T","Private","3747.00","2021","LOT 33 SHALIMAR ESTATES MCR 009101","Owner/Agent has lived here for nearly 30 years.  Formal living room and dining and step-down fireplace pit.   Large kitchen overlooking golf course with breakfast nook, tons of cabinetry, granite counters, double ovens, island with range and stainless vent cover and appliances. Basement has family room, laundry room and powder room.  Huge master bedroom on split level with updated bath including jetted, heated tub and dual sinks with granite counters. Walk-out deck off master bedroom overlooks golf course. 4 bedrooms or 3+office upstairs along with updated hall bath with dual sinks. Backyard features diving pool with large baja deck and fountain. Pool completely redone in 2020 ($37,000) to include pebble sheen, tile, Kool decking, equipment & diving board.   Huge 2-car garage with storage","Use ShowingTime.  Not on lockbox.  Escrow open with Chicago Title, Cathy Moreno, 480-874-7033, Cathy.Moreno@ctt.com, 1400 E. Southern  Ave., Ste. 910, Tempe 85282.  Escrow No. C230453.","133-47-033","","East on Southern to Fairfield.  North on Fairfield, Left on Fairway Dr. about 14 houses down on the golf course side","Knight/Wenz","480-203-8311","","Custom","2022-03-25 10:38:41.813598","","","T","Tempe","No","N","Fee Simple","","ER","Curry","Connolly","McClintock","003","213","Custom","","4025","","","2.00","0.00","","11500.00","133.00","47.00","33.00","","McClintock/Southern","SHALIMAR ESTATES","Detached","No","0.2640","2022-03-25","http://cdn.photos.sparkplatform.com/az/20220324182117788207000000.jpg","5","Living Room:|||||;Dining Room:|||||;Kitchen:|||||;Family Room:|||||;Other Room:|||||;Master Bedroom:|||||;Bedroom 2:|||||;Bedroom 3:|||||;Bedroom 4:|||||;Bedroom 5:|||||;AZ Room/Lanai:|||||;","Association & Fees|HOA Y/N|N;Items Updated|Floor Partial/Full|Partial;Items Updated|Pool Partial/Full|Full;Items Updated|Kitchen Partial/Full|Partial;Association & Fees|PAD Fee Y/N|N;Association & Fees|Land Lease Fee Y/N|N;Basement|Basement Y/N|Y;Separate Den/Office|Sep Den/Office Y/N|N;Showing Instructions|To Schedule Showing|Contact Via Text, Phone or Email;Showing Instructions|Primary Showing Contact|Listing Agent;Showing Instructions|Permission Required to Show|Yes;Showing Instructions|ARMLS Lockbox|No;Showing Instructions|Non-ARMLS Lockbox|No;Add'l Property Use|None|Yes;Additional Bedroom|Separate Bdrm Exit|Yes;Additional Bedroom|Othr Bdr Walkin Clst|Yes;Additional Bedroom|Mstr Bdr Walkin Clst|Yes;Architecture|Contemporary|Yes;Association & Fees|Ttl Mthly Fee Equiv|0;Basement Description|Finished|Yes;Basement Description|Walkout|Yes;Community Features|Golf Course|Yes;Community Features|Near Bus Stop|Yes;Contact Info|List Agent Home Phn|480-203-8311;Contact Info|Office Fax Number|480-491-0718;Contact Info|List Agent Cell Phn|480-203-8311;Contact Info|List Agt Primary Phn|480-203-8311;Energy/Green Feature|Multi-Zones|Yes;Exterior Features|Screened in Patio(s)|Yes;Exterior Features|Built-in BBQ|Yes;Exterior Features|Childrens Play Area|Yes;Exterior Features|Pvt Yrd(s)/Crtyrd(s)|Yes;Exterior Features|Balcony|Yes;Features|Central Vacuum|Yes;Features|Soft Water Loop|Yes;Flooring|Carpet|Yes;Flooring|Tile|Yes;Flooring|Linoleum|Yes;Items Updated|Floor Yr Updated|2019;Items Updated|Kitchen Yr Updated|2022;Items Updated|Pool Yr Updated|2020;Legal Info|Township|1N;Legal Info|Lot Number|33;Legal Info|Section|25;Legal Info|Range|4E;Master Bedroom|Split|Yes;Miscellaneous|Home Warranty|Yes;Other Rooms|Family Room|Yes;Other Rooms|Arizona Room/Lanai|Yes;Parking Features|Side Vehicle Entry|Yes;Parking Features|Dir Entry frm Garage|Yes;Parking Features|Separate Strge Area|Yes;Parking Features|Attch'd Gar Cabinets|Yes;Parking Features|Electric Door Opener|Yes;Parking Spaces|Garage Spaces|2;Parking Spaces|Total Covered Spaces|2;Parking Spaces|Slab Parking Spaces|5;Parking Spaces|Carport Spaces|0;Plumbing|Electric Hot Wtr Htr|Yes;Property Description|Golf Course Lot|Yes;Property Description|East/West Exposure|Yes;Road Responsibility|City Maintained Road|Yes;Services|City Services|Yes;Technology|Sat Dish TV Ownd|Yes;Technology|HighSpd Intrnt Aval|Yes;Technology|Cable TV Avail|Yes;Occupant - DND2|Owner|Yes;Possession|By Agreement|Yes;Spa|None|Yes;Heating|Natural Gas|Yes;Water|City Water|Yes;Disclosures|Seller Discl Avail|Yes;Disclosures|Agency Discl Req|Yes;Cooling|Ceiling Fan(s)|Yes;Cooling|HVAC SEER Rating|12;Cooling|Refrigeration|Yes;Dining Area|Formal|Yes;Dining Area|Breakfast Bar|Yes;Dining Area|Breakfast Room|Yes;Existing 1st Loan|Treat as Free&Clear|Yes;Sewer|Sewer - Public|Yes;Sewer|Sewer in & Cnctd|Yes;Const - Finish|Painted|Yes;Const - Finish|Stucco|Yes;Utilities|SRP|Yes;Utilities|SW Gas|Yes;Fencing|Wrought Iron|Yes;Fencing|Block|Yes;Master Bathroom|Full Bth Master Bdrm|Yes;Master Bathroom|Tub with Jets|Yes;Master Bathroom|Double Sinks|Yes;Pool Features|Private|Yes;Pool Features|Variable Speed Pump|Yes;Pool Features|Diving Pool|Yes;Laundry|Washer Included|Yes;Laundry|Inside|Yes;Laundry|Dryer Included|Yes;Roofing|Foam|Yes;Construction|Frame - Wood|Yes;Fireplace|1 Fireplace|Yes;Fireplace|Firepit|Yes;Assoc Rules/Info|None|Yes;New Financing|Cash|Yes;New Financing|Conventional|Yes;Special Listing Cond|Owner/Agent|Yes;Association Fee Incl|No Fees|Yes;Landscaping|Yrd Wtring Sys Front|Yes;Landscaping|Gravel/Stone Front|Yes;Landscaping|Auto Timer H2O Back|Yes;Landscaping|Auto Timer H2O Front|Yes;Landscaping|Grass Back|Yes;Landscaping|Grass Front|Yes;Landscaping|Yrd Wtring Sys Back|Yes;Kitchen Features|Dishwasher|Yes;Kitchen Features|Range/Oven Elec|Yes;Kitchen Features|Granite Countertops|Yes;Kitchen Features|Multiple Ovens|Yes;Kitchen Features|Wall Oven(s)|Yes;Kitchen Features|Cook Top Elec|Yes;Kitchen Features|Pantry|Yes;Kitchen Features|Disposal|Yes;"
"6373656","Offerpad (offe001)","(480) 470-2210","Derek Dickson","","Residential","Residential","","","","","Single Family - Detached","2022-03-25","","","","A","2022-03-25","","","","514900.00","514900.00","","370.97","S37","412","","E","Pegasus","","","DR","","Tempe","AZ","Maricopa","USA","85283","33.364466","-111.932265","1388.00","4.00","1972","%","Y","N","N","4","1.75","1","1","T","None","1756.00","2021","","Welcome home! Wonderful updated home on a spacious corner lot! All hard surface flooring throughout! Updated bathrooms. The kitchen offers quartz countertops and shaker cabinets. The backyard features a covered patio and storage shed. Come tour today!","Please use showingtime. Send all offers to contracts@offerpad. DO NOT SEND OFFERS THROUGH DOTLOOP. All offer MUST be accompanied with a prequal and docs uploaded in docs tab. Response times on offers - 24-48 hours. Seller name to be ''OP SPE PHX1, LLC  '' Preferred Title- First American","301-81-073","","Head east on E Orion St toward S El Camino Dr  Turn right onto S El Camino Dr  Continue onto E Pegasus Dr","OP SPE PHX1, LLC","","","Unknown","2022-03-25 10:01:16.230268","","","T","Tempe","No","N","Fee Simple","","EA","Aguila","Fees","Marcos De Niza","003","213","","","","","","2.50","","","7719.00","301.00","81.00","73.00","","Guadalupe and Rural","College Park","Detached","","0.1770","","http://cdn.photos.sparkplatform.com/az/20220325144923418613000000.jpg","5","","Association & Fees|HOA Y/N|N;Association & Fees|PAD Fee Y/N|N;Association & Fees|Land Lease Fee Y/N|N;Basement|Basement Y/N|N;Separate Den/Office|Sep Den/Office Y/N|N;Showing Instructions|To Schedule Showing|Use ShowingTime;Showing Instructions|Primary Showing Contact|Listing Agent;Showing Instructions|Permission Required to Show|Yes;Showing Instructions|ARMLS Lockbox|No;Showing Instructions|Non-ARMLS Lockbox|Yes;Architecture|Ranch|Yes;Association & Fees|Ttl Mthly Fee Equiv|0;Community Features|Near Bus Stop|Yes;Community Features|Clubhouse/Rec Room|Yes;Community Features|Biking/Walking Path|Yes;Community Features|Children's Playgrnd|Yes;Community Features|Comm Tennis Court(s)|Yes;Contact Info|List Agt Primary Phn|480-470-2210;Contact Info|List Agent Ofc Phn2|480-470-2210;Exterior Features|Covered Patio(s)|Yes;Legal Info|Lot Number|70;Other Rooms|Great Room|Yes;Parking Features|RV Gate|Yes;Parking Spaces|Garage Spaces|2;Parking Spaces|Total Covered Spaces|2;Parking Spaces|Slab Parking Spaces|2;Parking Spaces|Carport Spaces|0;Plumbing|Electric Hot Wtr Htr|Yes;Property Description|North/South Exposure|Yes;Windows|Vinyl Frame|Yes;Windows|Low-E|Yes;Windows|Dual Pane|Yes;Occupant - DND2|Vacant|Yes;Possession|Close of Escrow|Yes;Spa|None|Yes;Heating|Electric|Yes;Water|City Water|Yes;Disclosures|None|Yes;Cooling|Refrigeration|Yes;Dining Area|Eat-in Kitchen|Yes;Existing 1st Loan|Treat as Free&Clear|Yes;Sewer|Sewer - Public|Yes;Const - Finish|Painted|Yes;Const - Finish|Stucco|Yes;Utilities|SRP|Yes;Utilities|SW Gas|Yes;Fencing|Wood|Yes;Master Bathroom|3/4 Bath Master Bdrm|Yes;Pool Features|No Pool|Yes;Laundry|Wshr/Dry HookUp Only|Yes;Laundry|Inside|Yes;Roofing|Comp Shingle|Yes;Construction|Frame - Wood|Yes;Fireplace|No Fireplace|Yes;Assoc Rules/Info|None|Yes;New Financing|Cash|Yes;New Financing|Conventional|Yes;New Financing|VA|Yes;Special Listing Cond|N/A|Yes;Association Fee Incl|No Fees|Yes;Landscaping|Synthetic Grass Back|Yes;Kitchen Features|Dishwasher|Yes;Kitchen Features|Built-in Microwave|Yes;Kitchen Features|Range/Oven Elec|Yes;"
"6278231","My Home Group Real Estate (myhg02)","(480) 685-2760","Jason Bru","Brianna Scott","Residential","Residential","","","","","Single Family - Detached","2021-08-09","","","2022-03-18","A","2022-03-18","","","N","499900.00","499900.00","","367.57","R36","1315","","S","POLLY ANN","","","DR","","Tempe","AZ","Maricopa","USA","85281","33.414094","-111.957612","1360.00","3.00","1976","%","Y","N","N","3","2.00","1","1","T","Private","2081.00","2020","LOT 35 STARLITE MANOR MCR 017239","Look no further! This attractive pool home with a 2 car garage is located close to schools, restaurants, shopping, airport, less than one mile to ASU, & freeways. Lush green landscape surrounds this beautiful property, along with a NEW ROOF 2021. Discover a welcoming interior filled w/so much natural light, handsome neutral tile floors, neutral palette, & carpeted BD's. Gather around the fireplace on chilly AZ nights. Well-kept kitchen is a cook's delight w/plenty of counter space, breakfast bar, ample cabinetry, & fluorescent lighting. Continue onto the main BD to find patio access, dual shower heads & private en suite w/dual sinks. Inside laundry has built-in cabinets. Enjoy the covered patio & sparkling blue pool w/ diving board.  Don't wait any longer! Make this beauty yours today!","Showings are from 4:30p - 8 pm Mon-Friday and then all day on weekends. Occupants work from home.  Lease in place Lease is at $1500/month up until July 31st, 2022, $900 security deposit.  New roof   Please use Clear Title   6909 E. Greenway Parkway, Suite 120 Scottsdale AZ 85254  Kclifford@cleartitleaz.com  Kirsten Clifford","124-59-148","","Head south on Priest Dr, Turn left onto W 13th St, Turn right onto S Polly Ann Dr. Property will be on the left.","ROBERT A DELGARBINO","","","Unknown","2022-03-28 14:05:23.325899","","","T","Maricopa - COUNTY","No","N","Fee Simple","","ER","Holdeman","Gililland","Tempe High School","0003","213","","","6319","","","2.50","","","6351.00","124.00","59.00","148.00","","S University Dr & S Price Dr","STARLITE MANOR","Detached","","0.1460","2021-08-12","http://cdn.photos.sparkplatform.com/az/20211002145759739888000000.jpg","233","","Association & Fees|Rec Center Fee Y/N|N;Association & Fees|HOA Y/N|N;Association & Fees|PAD Fee Y/N|N;Association & Fees|Land Lease Fee Y/N|N;Association & Fees|Cap Impv/Impt Fee$/%|$;Association & Fees|Cap Impv/ImptFee2$/%|$;Association & Fees|Rec Center Fee 2 Y/N|N;Basement|Basement Y/N|N;Separate Den/Office|Sep Den/Office Y/N|N;Showing Instructions|To Schedule Showing|Contact Via ShowingTime, Text, Phone or Email;Showing Instructions|Primary Showing Contact|Listing Agent;Showing Instructions|Permission Required to Show|Yes;Showing Instructions|ARMLS Lockbox|Yes;Showing Instructions|Non-ARMLS Lockbox|No;Additional Bedroom|Separate Bdrm Exit|Yes;Association & Fees|Cap Impv/Impt Fee 2|0;Association & Fees|Ttl Mthly Fee Equiv|0;Association & Fees|Cap Imprv/Impact Fee|0;Community Features|Biking/Walking Path|Yes;Contact Info|List Agt Primary Phn|480-466-4917;Contact Info|CoList Primary Phn|858-344-6446;Contact Info|List Agent Cell Phn|480-466-4917;Exterior Features|Patio|Yes;Exterior Features|Covered Patio(s)|Yes;Features|No Interior Steps|Yes;Flooring|Carpet|Yes;Flooring|Tile|Yes;Legal Info|Township|1N;Legal Info|Lot Number|35;Legal Info|Section|21;Legal Info|Range|4E;Other Rooms|Great Room|Yes;Parking Features|RV Gate|Yes;Parking Features|Dir Entry frm Garage|Yes;Parking Features|Electric Door Opener|Yes;Parking Spaces|Garage Spaces|2;Parking Spaces|Total Covered Spaces|2;Parking Spaces|Slab Parking Spaces|2;Parking Spaces|Carport Spaces|0;Property Description|Corner Lot|Yes;Services|City Services|Yes;Showing Instructions|Tenants' Rights|Yes;Technology|Cable TV Avail|Yes;Technology|HighSpd Intrnt Aval|Yes;Windows|Dual Pane|Yes;Occupant - DND2|Tenant|Yes;Possession|Close of Escrow|Yes;Spa|None|Yes;Heating|Electric|Yes;Water|City Water|Yes;Disclosures|Seller Discl Avail|Yes;Disclosures|Agency Discl Req|Yes;Cooling|Ceiling Fan(s)|Yes;Cooling|Refrigeration|Yes;Dining Area|Dining in LR/GR|Yes;Dining Area|Breakfast Bar|Yes;Existing 1st Loan|Treat as Free&Clear|Yes;Sewer|Sewer - Public|Yes;Const - Finish|Painted|Yes;Utilities|SRP|Yes;Fencing|Block|Yes;Master Bathroom|3/4 Bath Master Bdrm|Yes;Master Bathroom|Private Toilet Room|Yes;Master Bathroom|Double Sinks|Yes;Pool Features|Private|Yes;Laundry|Washer Included|Yes;Laundry|Inside|Yes;Laundry|Dryer Included|Yes;Roofing|Comp Shingle|Yes;Construction|Block|Yes;Construction|Slump Block|Yes;Fireplace|1 Fireplace|Yes;Fireplace|Fireplace Living Rm|Yes;Assoc Rules/Info|None|Yes;New Financing|Cash|Yes;New Financing|Conventional|Yes;New Financing|FHA|Yes;New Financing|VA|Yes;Special Listing Cond|N/A|Yes;Association Fee Incl|No Fees|Yes;Landscaping|Grass Front|Yes;Kitchen Features|Dishwasher|Yes;Kitchen Features|Laminate Counters|Yes;Kitchen Features|Range/Oven Elec|Yes;Kitchen Features|Built-in Microwave|Yes;Kitchen Features|Refrigerator|Yes;Kitchen Features|Disposal|Yes;"
"5987886","Keller Williams Realty Sonoran Living (kwaf01)","(480) 759-4300","Mike Mendoza","","Residential","Residential","","","","","Single Family - Detached","2019-10-04","","","","A","2019-10-04","","","","429900.00","600000.00","","363.64","R36","1204","","S","ROOSEVELT","","","ST","","Tempe","AZ","Maricopa","USA","85281","33.415757","-111.947612","1650.00","5.00","1950","%","Y","N","N","5","2.00","1","1","T","None","2466.00","2019","LOT 33 STATE COLLEGE HOMES LOTS 33-40 MCR 003620","Prime Tempe location!  investment opportunity.  5 bedroom, 2 bathroom. Great room floor plan.  Separate building in back.    **DRIVE BY ONLY**  **DO NOT DISTURB TENANTS**   **VIEWING ONLY AFTER  ACCEPTED CONTRACT**","**DRIVE BY ONLY** **DO NOT DISTURB TENANTS** **VIEWING ONLY AFTER ACCEPTED CONTRACT**      Earnest Money to be $5,000 minimum.  Please see Documents tab for Addendum 1, Additional Clause Addendum & SPDS Waiver.","124-70-132","","SOUTH ON MILL, WEST ON 13TH ST, NORTH ON ROOSEVELT.","CLIENT OF KW","","","UNKNOWN","2022-03-28 16:50:14.29666","","","O","Tempe","No","N","Fee Simple","","ER","Holdeman","Gililland","Tempe High School","003","213","","","5451","","","2.50","","","8190.00","124.00","70.00","132.00","","MILL AVE & UNIVERSITY","STATE COLLEGE HOMES LOTS 33-40","Detached","","0.1880","","http://cdn.photos.sparkplatform.com/az/20191005182738311351000000.jpg","908","","Association & Fees|Rec Center Fee Y/N|N;Association & Fees|HOA Y/N|N;Association & Fees|PAD Fee Y/N|N;Association & Fees|Land Lease Fee Y/N|N;Association & Fees|Cap Impv/Impt Fee$/%|%;Association & Fees|Cap Impv/ImptFee2$/%|%;Association & Fees|Rec Center Fee 2 Y/N|N;Basement|Basement Y/N|N;Separate Den/Office|Sep Den/Office Y/N|N;Showing Instructions|To Schedule Showing|Contact Via Text, Phone or Email;Showing Instructions|Primary Showing Contact|Listing Agent;Showing Instructions|Permission Required to Show|Yes;Showing Instructions|ARMLS Lockbox|No;Showing Instructions|Non-ARMLS Lockbox|No;Association & Fees|Cap Impv/Impt Fee 2|0;Association & Fees|Ttl Mthly Fee Equiv|0;Association & Fees|Cap Imprv/Impact Fee|0;Contact Info|List Agt Primary Phn|602-430-3917;Contact Info|Office Fax Number|480-706-7329;Contact Info|List Agent Cell Phn|602-430-3917;Contact Info|List Agent Ofc Phn2|480-706-7234;Existing 1st Ln Trms|Non Assumable|Yes;Flooring|Carpet|Yes;Flooring|Tile|Yes;Legal Info|Township|1N;Legal Info|Lot Number|33;Legal Info|Section|21;Legal Info|Range|4E;Other Rooms|Great Room|Yes;Parking Spaces|Garage Spaces|0;Parking Spaces|Total Covered Spaces|1;Parking Spaces|Slab Parking Spaces|2;Parking Spaces|Carport Spaces|1;Pmt & Rate Info|Down Payment|0;Pmt & Rate Info|Total Asum Mnth Pmts|0;Showing Instructions|Special Instructions See Private Remarks|Yes;Showing Instructions|Tenants' Rights|Yes;Occupant - DND2|Tenant|Yes;Possession|By Agreement|Yes;Possession|Subject To Tenant Rights|Yes;Spa|None|Yes;Heating|Other|Yes;Heating|See Remarks|Yes;Water|City Water|Yes;Disclosures|Agency Discl Req|Yes;Cooling|Refrigeration|Yes;Dining Area|Other (See Remarks)|Yes;Existing 1st Loan|Conventional|Yes;Sewer|Sewer - Public|Yes;Const - Finish|Painted|Yes;Utilities|SRP|Yes;Utilities|SW Gas|Yes;Fencing|Other|Yes;Fencing|See Remarks|Yes;Master Bathroom|Other (See Remarks)|Yes;Pool Features|No Pool|Yes;Laundry|Wshr/Dry HookUp Only|Yes;Roofing|Comp Shingle|Yes;Construction|Block|Yes;Fireplace|Freestnd Fireplace|Yes;Assoc Rules/Info|None|Yes;New Financing|Cash|Yes;New Financing|1031 Exchange|Yes;New Financing|Wraparound|Yes;New Financing|Seller May Carry|Yes;New Financing|Conventional|Yes;Special Listing Cond|N/A|Yes;Association Fee Incl|No Fees|Yes;Landscaping|Grass Front|Yes;Landscaping|Grass Back|Yes;Kitchen Features|Range/Oven Elec|Yes;"
"6373601","eXp Realty (xpre07)","(888) 897-7821","Mark Organek","","Residential","Residential","","","","","Single Family - Detached","2022-03-25","","","","H","2022-03-25","","","","550000.00","550000.00","","367.16","S37","2129","","E","COLGATE","","","DR","","Tempe","AZ","Maricopa","USA","85283","33.375991","-111.895397","1498.00","3.00","1976","%","Y","N","Y","3","2.00","1","1","T","None","2139.00","2021","LOT 1343 KNOELL TEMPE UNIT 7 MCR 017816","Please pardon the ''work in progress'' pictures on this Tempe Arizona homes for sale with 3 bedrooms that is a complete remodel with so much new from the kitchen and bathrooms and roof to AC to appliances to flooring and security system and even the windows will be replaced this house is great for ASU or MCC student or faculty housing and it is minutes from Sky Harbor Airport and Intel as well as Chandler Fashion Square and Downtown Tempe Mill Avenue and Banner Desert Medical Center and you won't have to wait long as it is coming to the market soon and when it does do know this will be great for Spring Training or the 2023 Superbowl housing for Glendale in 2023. Sorry for the poor pictures.  As the contractors finish different parts of this complete remodel the pictures will be updated.","As of 3/25/2022, we are still awaiting delivery of windows and those will have to be installed before listing.  Anticipated completion date is April 13th.","305-01-410","","East on Baseline to South on River to East on Colgate to Home on Right.","VACANT","","","Knoell","2022-03-25 02:33:56.739085","","","T","Tempe","No","N","Fee Simple","5300","ER","Fuller","Fees","Marcos De Niza","003","213","","S","2405","","","2.50","","","6186.00","305.00","1.00","410.00","","Baseline and McClintock","KNOELL TEMPE UNIT 7","Detached","No","0.1420","2022-04-14","http://cdn.photos.sparkplatform.com/az/20220325073254019784000000.jpg","0","","Association & Fees|HOA Y/N|N;Items Updated|Floor Partial/Full|Full;Items Updated|Bath(s) Partial/Full|Full;Items Updated|Kitchen Partial/Full|Full;Items Updated|Roof Partial/Full|Full;Items Updated|Ht/Cool Partial/Full|Full;Association & Fees|PAD Fee Y/N|N;Association & Fees|Land Lease Fee Y/N|N;Basement|Basement Y/N|N;Separate Den/Office|Sep Den/Office Y/N|N;Showing Instructions|To Schedule Showing|Contact Via Text, Phone or Email;Showing Instructions|Permission Required to Show|Yes;Showing Instructions|ARMLS Lockbox|Yes;Showing Instructions|Non-ARMLS Lockbox|No;Add'l Property Use|None|Yes;Additional Bedroom|Mstr Bdr Walkin Clst|Yes;Architecture|Ranch|Yes;Association & Fees|Ttl Mthly Fee Equiv|0;Community Features|Near Bus Stop|Yes;Contact Info|List Agent Home Phn|602-790-0607;Contact Info|List Agent Cell Phn2|520-477-TACO;Contact Info|List Agent Cell Phn|602-790-0607;Contact Info|List Agt Primary Phn|602-790-0607;Exterior Features|Patio|Yes;Exterior Features|Covered Patio(s)|Yes;Flooring|Carpet|Yes;Flooring|Tile|Yes;Items Updated|Floor Yr Updated|2022;Items Updated|Ht/Cool Yr Updated|2021;Items Updated|Roof Yr Updated|2021;Items Updated|Kitchen Yr Updated|2022;Items Updated|Bath(s) Yr Updated|2022;Legal Info|Township|1S;Legal Info|Lot Number|1343;Legal Info|Section|1;Legal Info|Range|4E;Other Rooms|Family Room|Yes;Parking Spaces|Garage Spaces|0;Parking Spaces|Total Covered Spaces|2;Parking Spaces|Slab Parking Spaces|2;Parking Spaces|Carport Spaces|2;Property Access|Alarm Code - DND2|call lister;Property Description|North/South Exposure|Yes;Property Description|Alley|Yes;Road Responsibility|City Maintained Road|Yes;Services|City Services|Yes;Unit Style|All on One Level|Yes;Windows|Vinyl Frame|Yes;Windows|Low-E|Yes;Windows|Dual Pane|Yes;Occupant - DND2|Vacant|Yes;Possession|By Agreement|Yes;Possession|Close of Escrow|Yes;Spa|None|Yes;Heating|Electric|Yes;Water|City Water|Yes;Disclosures|Seller Discl Avail|Yes;Disclosures|Agency Discl Req|Yes;Cooling|Refrigeration|Yes;Dining Area|Eat-in Kitchen|Yes;Dining Area|Breakfast Bar|Yes;Existing 1st Loan|Treat as Free&Clear|Yes;Sewer|Sewer - Public|Yes;Sewer|Sewer in & Cnctd|Yes;Const - Finish|Painted|Yes;Utilities|SRP|Yes;Fencing|Block|Yes;Master Bathroom|3/4 Bath Master Bdrm|Yes;Pool Features|No Pool|Yes;Laundry|Washer Included|Yes;Laundry|Dryer Included|Yes;Roofing|Comp Shingle|Yes;Construction|Block|Yes;Fireplace|1 Fireplace|Yes;Assoc Rules/Info|None|Yes;New Financing|Cash|Yes;New Financing|Conventional|Yes;New Financing|FHA|Yes;New Financing|VA|Yes;Special Listing Cond|N/A|Yes;Association Fee Incl|No Fees|Yes;Landscaping|Gravel/Stone Front|Yes;Landscaping|Gravel/Stone Back|Yes;Kitchen Features|Dishwasher|Yes;Kitchen Features|Range/Oven Elec|Yes;Kitchen Features|Non-laminate Counter|Yes;Kitchen Features|Built-in Microwave|Yes;Kitchen Features|Cook Top Elec|Yes;Kitchen Features|Kitchen Island|Yes;Kitchen Features|Pantry|Yes;Kitchen Features|Disposal|Yes;"
