"List Number","Agency Name","Agency Phone","Listing Agent","Co-Listing Agent","Property Type","Card Format","Selling Agency","Selling Agent","Co-Selling Agent","End Date","Dwelling Type","List Date","Close of Escrow Date","Under Contract Date","Fallthrough Date","Status","Status Change Date","Temp Off Market Date","Cancel Date","UCB or CCBS","Original List Price","List Price","Sold Price","Price/SqFt","Map Code/Grid","House Number","Building Number","Compass","Street Name","Unit #","St Dir Sfx","St Suffix","Sub Agent $/%","City/Town Code","State/Province","County Code","Country","Zip Code","Geo Lat","Geo Lon","Approx SQFT","Bedrooms Plus","Year Built","Buyer Broker $/%","Buyer/Broker","Subagents","Variable Commission","# Bedrooms","# Bathrooms","# of Interior Levels","Exterior Stories","Source Apx Lot SqFt","Pool","Taxes","Tax Year","Legal Description (Abbrev)","Public Remarks","Private Rmks - DND2","Assessor Number","Legal","Directions","Ownr/Occ Name - DND2","Owner/Occ Phn - DND2","Marketing Name","Builder Name","mod_timestamp","Assessor Parcel Ltr","Out of Area Schl Dst","Source of SqFt","Tax Municipality","Auction","Horses","Ownership","Hundred Block","Type","Elementary School","Jr. High School","High School","Elem School Dist #","High School Dist #","Model","Hndrd Blk Directionl","Zip4","Week Avail Timeshare","Comp to Subagent","Comp to Buyer Broker","Other Compensation","Guest House SqFt","Approx Lot SqFt","Assessor's Book #","Assessor's Map #","Assessor's Parcel #","Off Market Date","Cross Street","Subdivision","Dwelling Styles","Flood Zone","Approx Lot Acres","On Market Date","Photo URL","Days on Market","Rooms","Features"
"6352779","Venture REI, LLC (vrei01)","(480) 269-8499","Daniel P Noma","Frank Vazquez","Residential","Residential","","","","","Single Family - Detached","2022-02-08","","","","A","2022-02-08","","","","657000.00","648000.00","","274.46","R37","2028","","S","COLLEGE","","","AVE","","Tempe","AZ","Maricopa","USA","85282","33.40634","-111.935209","2361.00","4.00","1956","%","Y","N","N","3","2.00","1","1","T","None","2772.00","2021","LOT 6 BROADMOOR ANNEX MCR 006445","Turn-key residence in Tempe is waiting for you! This charming 3 bed, 2 bath home offers mature front yard & carport parking. Come inside to discover a large-carpeted hallway that will take you from the front to the back & has access to the bedrooms. Spacious great room boasts neutral tile floor & updated lighting/ceiling fans. The kitchen is filled w/natural light & features new wood cabinets, recessed lighting, solid surface countertops, stainless steel appliances, a built-in desk, and a peninsula w/breakfast bar. All bedrooms enjoy soft new carpet. Out the back, you'll find a convenient storage shed, a workshop, & a lush backyard perfect for entertaining. This beauty is waiting on its new owner! Move-in, add your personal touches & make this house your home!","*** For real time number of offers go to http://current-listings.com. For other questions, please ONLY call 480-409-9900 or email Contracts@venturehomegroup.com. Please refer to the Offer Process and FAQ in the docs tab. ***All offers must be submitted through this link to be considered:  https://my.brokermint.com/offers/f90021130e/new","133-23-006","","East on Broadway to College Ave. South on College to property on the right.","Client of Venture REI","","","Lloyd Williams","2022-03-29 16:03:51.173992","","","T","Tempe","No","N","Fee Simple","","ER","Broadmor Elementary","Connolly","Tempe High School","003","213","","","2251","","","2.25","","","8930.00","133.00","23.00","6.00","","Broadway Rd. and Mill Ave","BROADMOOR ANNEX","Detached","","0.2050","","http://cdn.photos.sparkplatform.com/az/20220207235750830924000000.jpg","50","","Association & Fees|Rec Center Fee Y/N|N;Association & Fees|HOA Y/N|N;Association & Fees|PAD Fee Y/N|N;Association & Fees|Land Lease Fee Y/N|N;Association & Fees|Cap Impv/Impt Fee$/%|$;Association & Fees|Cap Impv/ImptFee2$/%|$;Association & Fees|Rec Center Fee 2 Y/N|N;Basement|Basement Y/N|N;Separate Den/Office|Sep Den/Office Y/N|N;Showing Instructions|To Schedule Showing|Use ShowingTime;Showing Instructions|Primary Showing Contact|Co-Listing Agent;Showing Instructions|Permission Required to Show|Yes;Showing Instructions|ARMLS Lockbox|Yes;Showing Instructions|Non-ARMLS Lockbox|No;Add'l Property Use|None|Yes;Architecture|Ranch|Yes;Association & Fees|Cap Impv/Impt Fee 2|0;Association & Fees|Ttl Mthly Fee Equiv|0;Association & Fees|Cap Imprv/Impact Fee|0;Community Features|Near Bus Stop|Yes;Community Features|Biking/Walking Path|Yes;Contact Info|List Agent Home Phn|480-409-9900;Contact Info|CoList Primary Phn|480-409-9900;Contact Info|List Agent Hme Phn 2|480-409-9900;Contact Info|List Agent Cell Phn2|480-409-9900;Contact Info|Office Fax Number|480-409-9900;Contact Info|List Agent Cell Phn|480-409-9900;Contact Info|List Agent Ofc Phn2|480-409-9900;Contact Info|List Agt Primary Phn|480-409-9900;Exterior Features|Patio|Yes;Exterior Features|Storage|Yes;Features|Skylight(s)|Yes;Flooring|Carpet|Yes;Flooring|Tile|Yes;Legal Info|Township|1N;Legal Info|Lot Number|6;Legal Info|Section|27;Legal Info|Range|4E;Other Rooms|Great Room|Yes;Other Rooms|Separate Workshop|Yes;Other Rooms|Bonus/Game Room|Yes;Parking Features|RV Parking|Yes;Parking Features|Separate Strge Area|Yes;Parking Spaces|Garage Spaces|0;Parking Spaces|Total Covered Spaces|2;Parking Spaces|Slab Parking Spaces|2;Parking Spaces|Carport Spaces|2;Plumbing|Engy Star Ht Wtr Htr|Yes;Plumbing|Electric Hot Wtr Htr|Yes;Pmt & Rate Info|Down Payment|0;Pmt & Rate Info|Total Asum Mnth Pmts|0;Property Description|Alley|Yes;Services|City Services|Yes;Technology|Cable TV Avail|Yes;Technology|HighSpd Intrnt Aval|Yes;Occupant - DND2|Vacant|Yes;Possession|Close of Escrow|Yes;Spa|None|Yes;Heating|Electric|Yes;Water|City Water|Yes;Disclosures|Other (See Remarks)|Yes;Cooling|Ceiling Fan(s)|Yes;Cooling|Programmable Thmstat|Yes;Cooling|Refrigeration|Yes;Dining Area|Dining in LR/GR|Yes;Dining Area|Breakfast Bar|Yes;Existing 1st Loan|Treat as Free&Clear|Yes;Sewer|Sewer - Public|Yes;Const - Finish|Painted|Yes;Const - Finish|Stucco|Yes;Utilities|SRP|Yes;Utilities|SW Gas|Yes;Fencing|Block|Yes;Fencing|Partial|Yes;Master Bathroom|None|Yes;Pool Features|No Pool|Yes;Laundry|Wshr/Dry HookUp Only|Yes;Laundry|220 V Dryer Hookup|Yes;Laundry|Inside|Yes;Roofing|Comp Shingle|Yes;Construction|Block|Yes;Fireplace|No Fireplace|Yes;Assoc Rules/Info|None|Yes;New Financing|Cash|Yes;New Financing|Conventional|Yes;New Financing|VA|Yes;Special Listing Cond|N/A|Yes;Association Fee Incl|No Fees|Yes;Landscaping|Dirt Front|Yes;Landscaping|Natural Desert Back|Yes;Landscaping|Natural Desert Front|Yes;Landscaping|Grass Back|Yes;Landscaping|Grass Front|Yes;Kitchen Features|Dishwasher|Yes;Kitchen Features|Non-laminate Counter|Yes;Kitchen Features|Reverse Osmosis|Yes;Kitchen Features|Built-in Microwave|Yes;Kitchen Features|Range/Oven Elec|Yes;Kitchen Features|Pantry|Yes;Kitchen Features|Disposal|Yes;"
"6374333","Hague Partners (hagu01)","(480) 998-0110","Vito F Teti","","Residential","Residential","","","","","Single Family - Detached","2022-03-26","","","","A","2022-03-27","","","","475000.00","475000.00","","239.90","S37","6749","","S","KENNETH","","","PL","","Tempe","AZ","Maricopa","USA","85283","33.359409","-111.920554","1980.00","4.00","1973","%","Y","N","N","4","2.00","1","1","T","Private","2502.00","2021","LOT 1586 TEMPE GARDENS 14 MCR 015114","72 Hour Home Sale - Bid Now! ***THE SELLERS WILL CONSIDER OFFERS STARTING FROM $475,000 TO $575,000*** Awesome & Well Maintained 4 Bed, 2 Bath, 2 Car Garage Ranch Style Home w/An Over-Sized Freshly Filled, Regularly Serviced 18,000 Gallon Swimming Pool, Covered Ramada Deck On An A Perfect East/West Cul-De-Sac Lot & No HOA; Large Laundry Room w/Washer, Dryer & Additional Refrigerator Included; Close To ASU, Downtown Tempe, Public Library, Great Schools, Shopping, Dining, Medical, Canal Bike Path, Sky Harbor, All Major Roads & Freeways; Won't Last Long So Come On Down!","72 Hour Home Sale - Bid Now! RANGE PRICED FROM $475K - $575K - Highest & Best Offers Only Please - The Tenant Needs A Reasonably Extended COE, Post Possession Or Short Term Lease-Back - TENANT OCCUPIED - NO DAILY SHOWINGS - THE SHOWING SCHEDULE TO BE DETERMINED - DO  NOT TEXT - EMAIL ANY QUESTIONS -","301-48-497","","From RURAL RD, East on GUADELUPE to LAKESHORE DR, South to BELLE DE MAR, West to KENNETH PL, North to address on Right (No Brokers Sign).","STEVEN L & ELAINE D FRANCISCO","","","Hallcraft","2022-03-27 12:22:13.318714","","","T","Tempe","No","N","Fee Simple","","ER","Kyrene del Norte","Kyrene Middle","Marcos De Niza","028","213","","","4119","","","2.50","","","7336.00","301.00","48.00","497.00","","RURAL RD & GUADELUPE","TEMPE GARDENS 14","Detached","No","0.1680","2022-03-26","http://cdn.photos.sparkplatform.com/az/20220326192019843635000000.jpg","3","","Association & Fees|HOA Y/N|N;Association & Fees|PAD Fee Y/N|N;Association & Fees|Land Lease Fee Y/N|N;Basement|Basement Y/N|N;Separate Den/Office|Sep Den/Office Y/N|N;Showing Instructions|To Schedule Showing|Contact Via Email;Showing Instructions|Primary Showing Contact|Listing Agent;Showing Instructions|Permission Required to Show|Yes;Showing Instructions|ARMLS Lockbox|No;Showing Instructions|Non-ARMLS Lockbox|No;Association & Fees|Ttl Mthly Fee Equiv|0;Contact Info|List Agt Primary Phn|4804048680 - NO TEXT;Contact Info|Office Fax Number|602-954-8070;Contact Info|List Agent Cell Phn|- DO NOT TEXT -;Flooring|Carpet|Yes;Flooring|Tile|Yes;Legal Info|Township|1S;Legal Info|Lot Number|1586;Legal Info|Section|11;Legal Info|Range|4E;Parking Spaces|Garage Spaces|2;Parking Spaces|Total Covered Spaces|2;Parking Spaces|Slab Parking Spaces|2;Parking Spaces|Carport Spaces|0;Showing Instructions|Special Instructions See Private Remarks|Yes;Showing Instructions|Tenants' Rights|Yes;Unit Style|All on One Level|Yes;Occupant - DND2|Tenant|Yes;Possession|By Agreement|Yes;Possession|Subject To Tenant Rights|Yes;Spa|None|Yes;Heating|Electric|Yes;Water|City Water|Yes;Disclosures|Seller Discl Avail|Yes;Cooling|Refrigeration|Yes;Dining Area|Formal|Yes;Existing 1st Loan|Conventional|Yes;Sewer|Sewer - Public|Yes;Const - Finish|Painted|Yes;Utilities|SRP|Yes;Fencing|Block|Yes;Master Bathroom|3/4 Bath Master Bdrm|Yes;Pool Features|Private|Yes;Laundry|Washer Included|Yes;Laundry|Dryer Included|Yes;Roofing|Comp Shingle|Yes;Construction|Block|Yes;Fireplace|1 Fireplace|Yes;Assoc Rules/Info|None|Yes;New Financing|Cash|Yes;New Financing|Conventional|Yes;Special Listing Cond|N/A|Yes;Association Fee Incl|No Fees|Yes;Landscaping|Gravel/Stone Front|Yes;Landscaping|Gravel/Stone Back|Yes;Kitchen Features|Dishwasher|Yes;Kitchen Features|Range/Oven Elec|Yes;Kitchen Features|Refrigerator|Yes;Kitchen Features|Disposal|Yes;"
"6372812","Realty ONE Group (reog14)","(480) 285-0000","Matt S. McCormick","Gilbert Quiroz","Residential","Residential","","","","","Single Family - Detached","2022-03-23","","","","A","2022-03-29","","","","569500.00","569500.00","","314.99","R36","1041","","W","18th","","","ST","","Tempe","AZ","Maricopa","USA","85281","33.409032","-111.955785","1808.00","4.00","1959","%","Y","N","Y","4","2.00","1","1","T","None","2065.00","2021","LOT 91 PARKSIDE MANOR 3 MCR 008104","Fantastic location, walking distance to ASU, restaurants, shopping & so much more. This well maintained, clean & move-in ready Holdeman Neighborhood home has ALL the BIG $$ ticket items, Roof, A/C, Hot H2O Heater, Windows already updated for you. The entryway greets you with a Large & Open floorplan in the family room & kitchen that features an oversized L-shaped eating island, SS appliances, granite c-tops, travertine flooring, stone backsplash & walk-in panty. Fresh interior paint. Bedrooms all have new carpet, bathrooms have newer vanities, glass door enclosures, tiled walk-in shower or tub/tile shower combo. Easy access to the inside laundry room with ample space for additional storage. Synthetic grass in the front yard & a covered patio with pavers & synthetic grass in the backyard.","All Offers due & reviewed by Seller @ 5pm on Sunday 4/3/2022. 24hr response time. Seller has never occupied the home, so SPDS are limited. Buyer/Buyer's agent to verify all information provided & considered important to Buyer. Information provided is deemed reliable, but may vary &/or not be entirely accurate. Buyer to cooperate with Seller's 1031 exchange sale at no additional cost to the Buyer.","124-73-095","","From Priest Dr head East on Broadway Rd, Go North(Left) onto Beck Ave, Turn left onto 18th St. Property will be on the left.","Client of Synergy RE Partners","ROG","","Unknown","2022-03-29 14:25:50.704254","","","T","Maricopa - COUNTY","No","N","Fee Simple","","ER","Holdeman","Gililland","Tempe High School","003","003","","","6453","","","2.00","","","6904.00","124.00","73.00","95.00","","Priest Dr & Broadway Rd","PARKSIDE MANOR 3","Detached","","0.1580","2022-03-29","http://cdn.photos.sparkplatform.com/az/20220329084719184522000000.jpg","1","","Association & Fees|Rec Center Fee Y/N|N;Association & Fees|HOA Y/N|N;Items Updated|Floor Partial/Full|Partial;Items Updated|Bath(s) Partial/Full|Full;Items Updated|Kitchen Partial/Full|Full;Items Updated|Roof Partial/Full|Full;Items Updated|Wiring Partial/Full|Partial;Items Updated|Plmbg Partial/Full|Partial;Items Updated|Ht/Cool Partial/Full|Full;Association & Fees|PAD Fee Y/N|N;Association & Fees|Land Lease Fee Y/N|N;Association & Fees|Cap Impv/Impt Fee$/%|$;Association & Fees|Cap Impv/ImptFee2$/%|$;Basement|Basement Y/N|N;Separate Den/Office|Sep Den/Office Y/N|N;Association & Fees|Com Facilities Distr|N;Showing Instructions|To Schedule Showing|Use ShowingTime;Showing Instructions|Primary Showing Contact|Listing Agent;Showing Instructions|Permission Required to Show|Yes;Showing Instructions|ARMLS Lockbox|Yes;Showing Instructions|Non-ARMLS Lockbox|No;Add'l Property Use|None|Yes;Additional Bedroom|Mstr Bdr Walkin Clst|Yes;Architecture|Ranch|Yes;Association & Fees|Cap Impv/Impt Fee 2|0;Association & Fees|Ttl Mthly Fee Equiv|0;Association & Fees|Cap Imprv/Impact Fee|0;Association & Fees|Land Lease Fee|0;Association & Fees|PAD Fee|0;Contact Info|List Agt Primary Phn|(480) 788-1747;Contact Info|CoList Primary Phn|602.397.0966;Contact Info|List Agent Cell Phn|(480) 788-1747;Exterior Features|Covered Patio(s)|Yes;Exterior Features|Storage|Yes;Features|9+ Flat Ceilings|Yes;Features|No Interior Steps|Yes;Flooring|Carpet|Yes;Flooring|Tile|Yes;Items Updated|Floor Yr Updated|2022;Items Updated|Wiring Yr Updated|2013;Items Updated|Plmbg Yr Updated|2016;Items Updated|Ht/Cool Yr Updated|2019;Items Updated|Roof Yr Updated|2019;Items Updated|Kitchen Yr Updated|2013;Items Updated|Bath(s) Yr Updated|2013;Legal Info|Township|1N;Legal Info|Lot Number|91;Legal Info|Section|21;Legal Info|Range|4E;Other Rooms|Family Room|Yes;Other Rooms|Great Room|Yes;Parking Features|RV Gate|Yes;Parking Spaces|Garage Spaces|0;Parking Spaces|Total Covered Spaces|2;Parking Spaces|Slab Parking Spaces|2;Parking Spaces|Carport Spaces|2;Plumbing|Gas Hot Water Heater|Yes;Property Access|Lockbox Location|H2O Pipe, West side;Property Description|Cul-De-Sac Lot|Yes;Property Description|North/South Exposure|Yes;Services|City Services|Yes;Technology|Cable TV Avail|Yes;Technology|HighSpd Intrnt Aval|Yes;Windows|Dual Pane|Yes;Windows|Tinted Windows|Yes;Occupant - DND2|Vacant|Yes;Possession|Close of Escrow|Yes;Spa|None|Yes;Heating|Natural Gas|Yes;Water|City Water|Yes;Disclosures|Agency Discl Req|Yes;Cooling|Ceiling Fan(s)|Yes;Cooling|Refrigeration|Yes;Dining Area|Eat-in Kitchen|Yes;Dining Area|Breakfast Bar|Yes;Dining Area|Dining in LR/GR|Yes;Existing 1st Loan|Treat as Free&Clear|Yes;Sewer|Sewer - Public|Yes;Sewer|Sewer in & Cnctd|Yes;Const - Finish|Painted|Yes;Utilities|APS|Yes;Utilities|SW Gas|Yes;Fencing|Wrought Iron|Yes;Fencing|Block|Yes;Master Bathroom|3/4 Bath Master Bdrm|Yes;Pool Features|No Pool|Yes;Laundry|Washer Included|Yes;Laundry|Inside|Yes;Laundry|Dryer Included|Yes;Roofing|Comp Shingle|Yes;Construction|Block|Yes;Fireplace|No Fireplace|Yes;Assoc Rules/Info|None|Yes;New Financing|Cash|Yes;New Financing|1031 Exchange|Yes;New Financing|Conventional|Yes;New Financing|VA|Yes;Special Listing Cond|N/A|Yes;Association Fee Incl|No Fees|Yes;Landscaping|Desert Front|Yes;Landscaping|Auto Timer H2O Front|Yes;Landscaping|Synthetic Grass Back|Yes;Landscaping|Synthetic Grass Frnt|Yes;Landscaping|Gravel/Stone Back|Yes;Landscaping|Gravel/Stone Front|Yes;Landscaping|Yrd Wtring Sys Back|Yes;Landscaping|Yrd Wtring Sys Front|Yes;Landscaping|Desert Back|Yes;Kitchen Features|Disposal|Yes;Kitchen Features|Range/Oven Gas|Yes;Kitchen Features|Granite Countertops|Yes;Kitchen Features|Walk-in Pantry|Yes;Kitchen Features|Built-in Microwave|Yes;Kitchen Features|Cook Top Gas|Yes;Kitchen Features|Kitchen Island|Yes;Kitchen Features|Refrigerator|Yes;"
"5987673","Keller Williams Realty Sonoran Living (kwaf01)","(480) 759-4300","Mike Mendoza","","Residential","Residential","","","","","Single Family - Detached","2019-10-04","","","","A","2019-10-04","","","","424900.00","550000.00","","451.56","R36","1221","","S","WILSON","","","ST","","Tempe","AZ","Maricopa","USA","85281","33.415196","-111.945341","1218.00","5.00","1945","%","Y","N","N","3","2.00","1","1","T","None","1425.00","2019","LOT 12 STATE COLLEGE HOMES LOTS 33-40 MCR 003620","PRIME TEMPE LOCATION. TWO BEDROOM PLUS DEN WITH TWO BATHROOMS. LOCATED MINUTES FROM ASU AND MILL AVENUE. GREAT ROOM FLOOR PLAN. ROOM OFF OF GARAGE PLUS BONUS ROOM COULD BE CONVERTED TO ADDITIONAL BEDROOMS. WOOD, TILE AND CONCRETE FLOORING.       **DRIVE BY ONLY** **DO NOT DISTURB TENANTS**","**DRIVE BY ONLY** **DO NOT DISTURB TENANTS**  Earnest Money to be $5,000 minimum.  Please see Documents tab for Addendum 1, Additional Clause Addendum & SPDS Waiver.","124-70-035","","WEST ON WEST UNIVERSITY DRIVE TO SOUTH WILSON STREET; SOUTH ON SOUTH WILSON STREET TO PROPERTY ON YOUR LEFT.     **DRIVE BY ONLY** **DO NOT DISTURB TENANTS**","CLIENT OF KELLER WILLIAMS","","","UNK","2022-03-28 16:47:52.219317","","","T","Tempe","No","N","Fee Simple","","ER","Holdeman","Gililland","Tempe High School","003","213","","","5534","","","2.50","","","9500.00","124.00","70.00","35.00","","WEST UNIVERSITY DRIVE & SOUTH MILL AVENUE","STATE COLLEGE HOMES LOTS 33-40","Detached","","0.2180","","http://cdn.photos.sparkplatform.com/az/20191005183146689721000000.jpg","908","","Association & Fees|Rec Center Fee Y/N|N;Association & Fees|HOA Y/N|N;Association & Fees|PAD Fee Y/N|N;Association & Fees|Land Lease Fee Y/N|N;Association & Fees|Cap Impv/Impt Fee$/%|$;Association & Fees|Cap Impv/ImptFee2$/%|$;Association & Fees|Rec Center Fee 2 Y/N|N;Basement|Basement Y/N|N;Separate Den/Office|Sep Den/Office Y/N|Y;Showing Instructions|To Schedule Showing|Contact Via Text, Phone or Email;Showing Instructions|Permission Required to Show|Yes;Showing Instructions|ARMLS Lockbox|No;Showing Instructions|Non-ARMLS Lockbox|No;Association & Fees|Cap Impv/Impt Fee 2|0;Association & Fees|Ttl Mthly Fee Equiv|0;Association & Fees|Cap Imprv/Impact Fee|0;Contact Info|List Agt Primary Phn|602-430-3917;Contact Info|Office Fax Number|480-706-7329;Contact Info|List Agent Cell Phn|602-430-3917;Contact Info|List Agent Ofc Phn2|480-706-7234;Existing 1st Ln Trms|Non Assumable|Yes;Flooring|Tile|Yes;Flooring|Concrete|Yes;Flooring|Wood|Yes;Legal Info|Township|1N;Legal Info|Lot Number|12;Legal Info|Section|21;Legal Info|Range|4E;Other Rooms|Great Room|Yes;Other Rooms|Separate Workshop|Yes;Other Rooms|Arizona Room/Lanai|Yes;Other Rooms|Bonus/Game Room|Yes;Parking Spaces|Garage Spaces|1;Parking Spaces|Total Covered Spaces|1;Parking Spaces|Slab Parking Spaces|2;Parking Spaces|Carport Spaces|0;Pmt & Rate Info|Down Payment|0;Pmt & Rate Info|Total Asum Mnth Pmts|0;Services|City Services|Yes;Showing Instructions|Tenants' Rights|Yes;Occupant - DND2|Tenant|Yes;Possession|Subject To Tenant Rights|Yes;Spa|None|Yes;Heating|Electric|Yes;Water|City Water|Yes;Disclosures|Agency Discl Req|Yes;Cooling|Refrigeration|Yes;Dining Area|Dining in LR/GR|Yes;Existing 1st Loan|Conventional|Yes;Sewer|Sewer - Public|Yes;Sewer|Sewer in & Cnctd|Yes;Const - Finish|Painted|Yes;Utilities|SRP|Yes;Utilities|SW Gas|Yes;Fencing|Wood|Yes;Master Bathroom|3/4 Bath Master Bdrm|Yes;Pool Features|No Pool|Yes;Laundry|Wshr/Dry HookUp Only|Yes;Laundry|Inside|Yes;Roofing|Comp Shingle|Yes;Construction|Block|Yes;Fireplace|No Fireplace|Yes;Assoc Rules/Info|None|Yes;New Financing|Cash|Yes;New Financing|1031 Exchange|Yes;New Financing|Wraparound|Yes;New Financing|Seller May Carry|Yes;New Financing|Conventional|Yes;Special Listing Cond|N/A|Yes;Association Fee Incl|No Fees|Yes;Landscaping|Gravel/Stone Front|Yes;Kitchen Features|Range/Oven Elec|Yes;"
"5987740","Keller Williams Realty Sonoran Living (kwaf01)","(480) 759-4300","Mike Mendoza","","Residential","Residential","","","","","Single Family - Detached","2019-10-04","","","","A","2019-10-04","","","","399900.00","485000.00","","317.20","R36","1018","","W","12TH","","","PL","","Tempe","AZ","Maricopa","USA","85281","33.415611","-111.952887","1529.00","4.00","1963","%","Y","N","N","4","2.00","1","1","T","None","1571.00","2019","LOT 214 PARKWAY MANOR 4 MCR 010223","PRIME TEMPE LOCATION. FOUR BEDROOM, THREE BATH LOCATED MINUTES FROM ASU AND MILL AVENUE. SALTILLO TILE. LARGE KITCHEN WITH OAK CABINETRY. COVERED PATIO. SINGLE CARPORT. THIRD BATHROOM ACCESS IS OUTSIDE BY LANDRY ROOM.","**DO NOT DISTURB TENANTS** **VIEWING ONLY AFTER ACCEPTED CONTRACT** Earnest Money to be $5,000 minimum.  Please see Documents tab for Addendum 1, Additional Clause Addendum & SPDS Waiver.","124-77-086","","SOUTH ON SOUTH HARDY DRIVE TO WEST 12TH PLACE; WEST ON WEST 12TH PLACE TO PROPERTY ON YOUR RIGHT.","CLIENT OF KELLER WILLIAMS","","","UKN","2022-03-28 16:48:26.094053","","","O","Tempe","No","N","Fee Simple","","ER","Holdeman","Gililland","Tempe High School","003","213","","","5336","","","2.50","","","6268.00","124.00","77.00","86.00","","WEST UNIVERSITY DRIVE &  SOUTH HARDY DRIVE","PARKWAY MANOR 4","Detached","","0.1440","","http://cdn.photos.sparkplatform.com/az/20191004225428184377000000.jpg","908","","Association & Fees|Rec Center Fee Y/N|N;Association & Fees|HOA Y/N|N;Association & Fees|PAD Fee Y/N|N;Association & Fees|Land Lease Fee Y/N|N;Association & Fees|Cap Impv/Impt Fee$/%|$;Association & Fees|Cap Impv/ImptFee2$/%|$;Association & Fees|Rec Center Fee 2 Y/N|N;Basement|Basement Y/N|N;Separate Den/Office|Sep Den/Office Y/N|N;Showing Instructions|To Schedule Showing|Contact Via Text, Phone or Email;Showing Instructions|Primary Showing Contact|Listing Agent;Showing Instructions|Permission Required to Show|Yes;Showing Instructions|ARMLS Lockbox|No;Showing Instructions|Non-ARMLS Lockbox|No;Association & Fees|Cap Impv/Impt Fee 2|0;Association & Fees|Ttl Mthly Fee Equiv|0;Association & Fees|Cap Imprv/Impact Fee|0;Contact Info|List Agt Primary Phn|602-430-3917;Contact Info|Office Fax Number|480-706-7329;Contact Info|List Agent Cell Phn|602-430-3917;Contact Info|List Agent Ofc Phn2|480-706-7234;Existing 1st Ln Trms|Non Assumable|Yes;Exterior Features|Covered Patio(s)|Yes;Flooring|Carpet|Yes;Flooring|Tile|Yes;Legal Info|Township|1N;Legal Info|Lot Number|214;Legal Info|Section|21;Legal Info|Range|4E;Other Rooms|Great Room|Yes;Parking Spaces|Garage Spaces|0;Parking Spaces|Total Covered Spaces|1;Parking Spaces|Slab Parking Spaces|1;Parking Spaces|Carport Spaces|1;Pmt & Rate Info|Down Payment|0;Pmt & Rate Info|Total Asum Mnth Pmts|0;Property Description|North/South Exposure|Yes;Property Description|Alley|Yes;Services|City Services|Yes;Showing Instructions|Special Instructions See Private Remarks|Yes;Showing Instructions|Tenants' Rights|Yes;Occupant - DND2|Tenant|Yes;Possession|By Agreement|Yes;Possession|Subject To Tenant Rights|Yes;Spa|None|Yes;Heating|Electric|Yes;Water|City Water|Yes;Disclosures|Agency Discl Req|Yes;Cooling|Refrigeration|Yes;Dining Area|Eat-in Kitchen|Yes;Existing 1st Loan|Conventional|Yes;Sewer|Sewer - Public|Yes;Sewer|Sewer in & Cnctd|Yes;Const - Finish|Painted|Yes;Utilities|SRP|Yes;Fencing|Chain Link|Yes;Master Bathroom|None|Yes;Pool Features|No Pool|Yes;Laundry|Wshr/Dry HookUp Only|Yes;Roofing|Comp Shingle|Yes;Construction|Block|Yes;Fireplace|No Fireplace|Yes;Assoc Rules/Info|None|Yes;New Financing|Cash|Yes;New Financing|1031 Exchange|Yes;New Financing|Wraparound|Yes;New Financing|Seller May Carry|Yes;New Financing|Conventional|Yes;Special Listing Cond|N/A|Yes;Association Fee Incl|No Fees|Yes;Landscaping|Grass Front|Yes;Landscaping|Grass Back|Yes;Kitchen Features|Dishwasher|Yes;Kitchen Features|Range/Oven Elec|Yes;"
